{
  "id": "aelithia",
  "enabled": true,
  "editorial": {
    "public_name": "Aelithia",
    "handle": "@Aelithia-c1f",
    "topic": "historias de relaciones, dilemas morales, confesiones de Reddit, drama familiar y ¿Soy el Malo?",
    "tone": "empático, reflexivo, intrigante, emocional y conversacional",
    "channel_url": "https://www.youtube.com/@Aelithia-c1f",
    "persona_system_prompt": "Eres Aelithia, una narradora empática e introspectiva que presenta dilemas humanos y reflexiones profundas...",
    "language": "es",
    "category_id": "24",
    "title_prefix": "[CONFESIÓN] ",
    "title_suffix": " | Aelithia",
    "default_title_fallback": "¿Soy el Malo por mi Decisión?",
    "description_summary_template": "Una historia conmovedora y llena de dilemas en Aelithia.",
    "community_question": "¿Habrías actuado igual en esta situación? Cuéntanos tu opinión en los comentarios.",
    "tags": ["reddit", "soy el malo", "historias de reddit", "drama", "relaciones", "confesiones", "aelithia"],
    "shorts_hashtags": ["#Shorts", "#RedditHistorias", "#Drama", "#Relaciones", "#SoyElMalo"],
    "thematic_scoring_keywords": ["esposo", "esposa", "boda", "familia", "secreto", "infidelidad", "dinero", "suegra", "hermano", "divorcio", "confesion"]
  },
  "visual": {
    "style_id": "warm_melodrama",
    "palette": {
      "primary": "#1A0E18",
      "secondary": "#2D1B28",
      "accent": "#FF4081",
      "shadow": "#0F070E",
      "highlight": "#FFD180",
      "kelvin": 3200,
      "lut_profile": "warm_melodrama_amber",
      "contrast_curve": "soft_portrait_s_curve",
      "saturation_modifier": 1.15
    },
    "typography": {
      "font_bold": "Montserrat-Black.ttf",
      "font_regular": "Montserrat-Black.ttf",
      "font_subtitles": "Montserrat Black",
      "subtitle_font_size": 64,
      "subtitle_primary_color": "&H00FFFFFF",
      "subtitle_secondary_color": "&H00D8B4FE",
      "subtitle_outline_color": "&H00000000",
      "subtitle_back_color": "&HAA000000",
      "subtitle_outline_width": 4,
      "subtitle_shadow_depth": 3,
      "subtitle_alignment": 5,
      "subtitle_margin_v": 240
    },
    "default_weather_effect": "rain",
    "default_particle_layer": "dust_motes",
    "default_camera_motion": "slow_pan_right",
    "vignette_default_strength": 0.25,
    "watermark_text": "@Aelithia",
    "prompt_style_prefix": "Cinematic emotional storytelling shot, soft bokeh, warm dramatic lighting, 8k",
    "prompt_style_suffix": "photorealistic, Arri Alexa, 35mm lens, shallow depth of field",
    "negative_prompt": "horror, scary, blood, monster, dark, blurry, low resolution",
    "archetype_mappings": {
      "drama": "drama",
      "arcade": "drama",
      "parkour": "drama",
      "gameplay": "drama",
      "mind": "cozy_ambient",
      "cabin": "drama",
      "confession": "drama"
    }
  },
  "audio": {
    "default_voice_profile": "es-MX-DaliaNeural",
    "default_tts_provider": "edge-tts",
    "speech_volume": 1.0,
    "music_volume": 0.05,
    "ambient_volume": 0.08,
    "ducking_db": -16.0,
    "default_bg_theme": "drama"
  },
  "auth": {
    "cookies_path": "secrets/cookies_aelithia.json",
    "youtube_token_path": "secrets/youtube_token_aelithia.json",
    "expected_youtube_channel_id": "UCviycs3wnL019JwUwb8Hkig",
    "source_feed": "r/AmItheAsshole+r/relationship_advice"
  }
}
