{
  "id": "scifi",
  "enabled": false,
  "editorial": {
    "public_name": "Singularidad Sci-Fi",
    "handle": "@SingularidadSciFi",
    "topic": "ciencia ficción dura, paradojas temporales, inteligencia artificial y exploración espacial",
    "tone": "analítico, sobrecogedor, especulativo y futurista",
    "channel_url": "https://www.youtube.com/@SingularidadSciFi",
    "persona_system_prompt": "Eres un narrador analítico y archivista de ciencia ficción dura y astrofísica especulativa...",
    "language": "es",
    "category_id": "28",
    "title_prefix": "[REGISTRO ESTELAR] ",
    "title_suffix": " | Singularidad Sci-Fi",
    "default_title_fallback": "Expedición al Horizonte de Sucesos",
    "description_summary_template": "Una travesía por los límites de la física y la exploración espacial en Singularidad Sci-Fi.",
    "community_question": "¿Crees que la humanidad sobrevivirá al Gran Filtro? Deja tu perspectiva.",
    "tags": ["ciencia ficcion", "espacio", "paradojas temporales", "astronomia", "agujeros negros", "scifi"],
    "shorts_hashtags": ["#Shorts", "#SciFi", "#Espacio", "#Astronomía", "#CienciaFicción"],
    "thematic_scoring_keywords": ["singularidad", "agujero negro", "relatividad", "nave", "planeta", "tiempo", "ia", "robot", "antimateria", "alien"]
  },
  "visual": {
    "style_id": "cyberpunk_cosmic",
    "palette": {
      "primary": "#050B14",
      "secondary": "#0A192F",
      "accent": "#00F0FF",
      "shadow": "#020408",
      "highlight": "#64FFDA",
      "kelvin": 6500,
      "lut_profile": "cyberpunk_teal_orange",
      "contrast_curve": "cinematic_s_curve",
      "saturation_modifier": 1.05
    },
    "typography": {
      "font_bold": "Montserrat-Black.ttf",
      "font_regular": "Montserrat-Black.ttf",
      "font_subtitles": "Montserrat Black",
      "subtitle_font_size": 64,
      "subtitle_primary_color": "&H00FFFF00",
      "subtitle_secondary_color": "&H00FF00FF",
      "subtitle_outline_color": "&H00000000",
      "subtitle_back_color": "&HAA000000",
      "subtitle_outline_width": 4,
      "subtitle_shadow_depth": 3,
      "subtitle_alignment": 5,
      "subtitle_margin_v": 240
    },
    "default_weather_effect": "crt_phosphor",
    "default_particle_layer": "electric_embers",
    "default_camera_motion": "slow_zoom_in",
    "vignette_default_strength": 0.35,
    "watermark_text": "SINGULARIDAD // SCI-FI",
    "prompt_style_prefix": "8k masterpiece sci-fi concept art, hard science fiction, Arri Alexa, 35mm",
    "prompt_style_suffix": "volumetric lighting, photorealistic, cinematic, deep space",
    "negative_prompt": "fantasy, medieval, low quality, blurry, cartoon",
    "archetype_mappings": {
      "singularity": "cosmic_horror",
      "space": "deep_space",
      "vortex": "space_abyss",
      "terminal": "scifi",
      "neural": "cyberpunk"
    }
  },
  "audio": {
    "default_voice_profile": "scifi_documentary_es",
    "default_tts_provider": "edge-tts",
    "speech_volume": 1.0,
    "music_volume": 0.04,
    "ambient_volume": 0.10,
    "ducking_db": -18.0,
    "default_bg_theme": "space_ambient"
  },
  "auth": {
    "cookies_path": "secrets/cookies_scifi.txt",
    "youtube_token_path": "secrets/youtube_token_scifi.json",
    "expected_youtube_channel_id": "UC_SCIFI_CHANNEL_PLACEHOLDER",
    "source_feed": "r/HFY+r/scifi"
  }
}
