{
  "id": "moku",
  "enabled": true,
  "editorial": {
    "public_name": "Moku",
    "handle": "@MokuRedit",
    "topic": "terror psicológico, historias de la Fundación SCP, horror analógico, fenómenos inexplicables y creepypastas",
    "tone": "oscuro, inmersivo, solemne, tenso y cinematográfico",
    "channel_url": "https://www.youtube.com/@MokuRedit",
    "persona_system_prompt": "Eres un narrador veterano y archivista de expedientes anómalos y terror psicológico...",
    "language": "es",
    "category_id": "24",
    "title_prefix": "[REGISTRO CLASIFICADO] ",
    "title_suffix": " | Moku",
    "default_title_fallback": "Historia de Terror",
    "description_summary_template": "Una impactante narración de horror cósmico y misterio en Moku.",
    "community_question": "¿Qué habrías hecho tú ante este fenómeno? Deja tu teoría en los comentarios.",
    "tags": ["historias de terror", "terror", "scp", "horror analogo", "creepypasta", "misterio", "paranormal", "relatos de terror", "moku"],
    "shorts_hashtags": ["#Shorts", "#Terror", "#SCP", "#Misterio", "#Horror"],
    "thematic_scoring_keywords": ["scp", "anomalia", "criatura", "monstruo", "bunker", "terror", "abismo", "sombra", "muerte", "expediente", "clasificado"]
  },
  "visual": {
    "style_id": "cosmic_chiaroscuro",
    "palette": {
      "primary": "#030A14",
      "secondary": "#0A192F",
      "accent": "#00FF66",
      "shadow": "#010408",
      "highlight": "#64FFDA",
      "kelvin": 4800,
      "lut_profile": "horror_cold_cyan",
      "contrast_curve": "crushed_blacks_s_curve",
      "saturation_modifier": 0.85
    },
    "typography": {
      "font_bold": "Montserrat-Black.ttf",
      "font_regular": "Montserrat-Black.ttf",
      "font_subtitles": "Montserrat Black",
      "subtitle_font_size": 68,
      "subtitle_primary_color": "&H0000FFFF",
      "subtitle_secondary_color": "&H00FFFFFF",
      "subtitle_outline_color": "&H00000000",
      "subtitle_back_color": "&HAA000000",
      "subtitle_outline_width": 4,
      "subtitle_shadow_depth": 3,
      "subtitle_alignment": 5,
      "subtitle_margin_v": 240
    },
    "default_weather_effect": "dense_fog",
    "default_particle_layer": "floating_embers",
    "default_camera_motion": "slow_zoom_in",
    "vignette_default_strength": 0.45,
    "watermark_text": "MOKU // CLASIFICADO",
    "prompt_style_prefix": "Masterpiece 8k cinematic atmospheric matte painting, dark horror chiaroscuro",
    "prompt_style_suffix": "35mm photograph, shot on Arri Alexa, Rec.709 color grade, anamorphic lens flare",
    "negative_prompt": "cartoon, low resolution, blurry, happy, sunny, saturated colors, cluttered",
    "archetype_mappings": {
      "terminal": "classified_terminal",
      "radar": "classified_terminal",
      "bunker": "containment_chamber",
      "chamber": "containment_chamber",
      "corridor": "tactical_chamber",
      "wasteland": "dark_forest",
      "landscape": "dark_forest",
      "monolith": "dark_forest",
      "creature": "horror",
      "monster": "horror",
      "titan": "horror",
      "abyss": "cosmic_horror",
      "ocean": "dark_ambient",
      "lighthouse": "dark_forest",
      "vortex": "cosmic_horror",
      "singularity": "cosmic_horror",
      "space": "cosmic_horror",
      "mind": "dark_ambient",
      "neural": "dark_ambient"
    }
  },
  "audio": {
    "default_voice_profile": "es-MX-JorgeNeural",
    "default_tts_provider": "edge-tts",
    "speech_volume": 1.0,
    "music_volume": 0.04,
    "ambient_volume": 0.12,
    "ducking_db": -18.0,
    "default_bg_theme": "scp"
  },
  "auth": {
    "cookies_path": "secrets/cookies.json",
    "youtube_token_path": "secrets/tokens/moku.json",
    "expected_youtube_channel_id": "UC8sStaR-cwz-x7MD4XKNUKA",
    "source_feed": "r/nosleep+r/SCP"
  }
}
